{
  "$schema": "https://json-schema.org/draft/2020-12/schema",
  "$id": "https://memorydirector.dev/terraform-config.schema.json",
  "title": "Memory Director Terraform non-sensitive configuration",
  "type": "object",
  "additionalProperties": false,
  "properties": {
    "project_id": { "type": "string", "minLength": 1 },
    "project_number": { "type": "string", "pattern": "^[0-9]+$" },
    "resource_name": { "type": "string", "pattern": "^[a-z][a-z0-9-]{2,62}$" },
    "environment": { "type": "string", "enum": ["sandbox"] },
    "default_region": { "type": "string", "minLength": 1 },
    "region": { "type": "string", "minLength": 1 },
    "allow_destroy": { "type": "boolean" },
    "state_bucket_name": { "type": "string", "minLength": 3 },
    "github_repository": { "type": "string", "pattern": "^[^/]+/[^/]+$" },
    "mcp_image": { "type": "string", "minLength": 1 },
    "enable_mcp": { "type": "boolean" },
    "mcp_secret_project_id": { "type": "string", "minLength": 1 },
    "mcp_invoker_service_account_email": { "type": "string", "pattern": "^[^@\\s]+@[^@\\s]+\\.iam\\.gserviceaccount\\.com$" },
    "mcp_endpoint": { "type": "string", "pattern": "^https://" },
    "consent_event_writer_image": { "type": "string", "minLength": 1 },
    "agent_engine": {
      "type": "object",
      "additionalProperties": false,
      "required": ["enabled", "runtime_service_account_email", "staging_bucket_name"],
      "properties": {
        "enabled": { "type": "boolean" },
        "runtime_service_account_email": {
          "type": "string",
          "pattern": "^memory-director-agent@[^@\\s]+\\.iam\\.gserviceaccount\\.com$"
        },
        "staging_bucket_name": { "type": "string", "minLength": 3 }
      }
    },
    "public_edge": {
      "type": "object",
      "additionalProperties": false,
      "required": ["apex_domain", "cloudflare_zone_id", "api_path_prefix"],
      "properties": {
        "apex_domain": { "type": "string", "pattern": "^[a-z0-9][a-z0-9.-]+[a-z0-9]$" },
        "cloudflare_zone_id": { "type": "string", "pattern": "^[a-f0-9]{32}$" },
        "api_path_prefix": { "type": "string", "const": "/api" }
      }
    },
    "labels": { "type": "object", "additionalProperties": { "type": "string" } }
  }
}
